{
  "status": "ok",
  "data": {
    "ssot_count": 10,
    "schemas_present": [
      "docs/schemas/envelope.v1.2.schema.json",
      "docs/schemas/entity.schema.json",
      "docs/schemas/envelope.schema.json"
    ]
  },
  "error": null,
  "meta": {
    "run_id": "20250912T120000Z-abcdef",
    "timestamp": "2025-09-13T02:30:55.525498Z",
    "source": "cli",
    "schema_version": "1.1.0-pr000"
  }
}